{"$id":"https://awesome-self-skills.local/schemas/v5-stable-id-preimage-registry.schema.json","$schema":"https://json-schema.org/draft/2020-12/schema","additionalProperties":false,"properties":{"canonical_profile":{"const":"v5.canonical-json.v1"},"registry_digest":{"const":"sha256:9026224f3ea47b4f57be676de47b3d8d6d7a568381dc615bb53a9a53568eba81"},"registry_format_version":{"const":1},"rows":{"items":false,"maxItems":28,"minItems":28,"prefixItems":[{"additionalProperties":false,"properties":{"golden_test_id":{"const":"F-C15-protocol.positive.baseline"},"object_kind":{"const":"ambiguity_candidate"},"prefix":{"const":"amb5_"},"projection_id":{"const":"stable.ambiguity-candidate.v1"}},"required":["object_kind","prefix","projection_id","golden_test_id"],"type":"object"},{"additionalProperties":false,"properties":{"golden_test_id":{"const":"F-C15-protocol.positive.baseline"},"object_kind":{"const":"behavior_equivalence_contract"},"prefix":{"const":"beq5_"},"projection_id":{"const":"stable.behavior-equivalence-contract.v1"}},"required":["object_kind","prefix","projection_id","golden_test_id"],"type":"object"},{"additionalProperties":false,"properties":{"golden_test_id":{"const":"F-C15-protocol.positive.baseline"},"object_kind":{"const":"behavior_required_contract"},"prefix":{"const":"brq5_"},"projection_id":{"const":"stable.behavior-required-contract.v1"}},"required":["object_kind","prefix","projection_id","golden_test_id"],"type":"object"},{"additionalProperties":false,"properties":{"golden_test_id":{"const":"F-C15-protocol.positive.baseline"},"object_kind":{"const":"behavior_semantic_gap"},"prefix":{"const":"bsg5_"},"projection_id":{"const":"stable.behavior-semantic-gap.v1"}},"required":["object_kind","prefix","projection_id","golden_test_id"],"type":"object"},{"additionalProperties":false,"properties":{"golden_test_id":{"const":"F-C15-protocol.positive.baseline"},"object_kind":{"const":"clarification_decision"},"prefix":{"const":"dec5_"},"projection_id":{"const":"stable.clarification-decision.v1"}},"required":["object_kind","prefix","projection_id","golden_test_id"],"type":"object"},{"additionalProperties":false,"properties":{"golden_test_id":{"const":"F-C15-protocol.positive.baseline"},"object_kind":{"const":"clarification_presentation"},"prefix":{"const":"qpr5_"},"projection_id":{"const":"stable.clarification-presentation.v1"}},"required":["object_kind","prefix","projection_id","golden_test_id"],"type":"object"},{"additionalProperties":false,"properties":{"golden_test_id":{"const":"F-C15-protocol.positive.baseline"},"object_kind":{"const":"derived_risk_ledger_item"},"prefix":{"const":"rsk5_"},"projection_id":{"const":"stable.derived-risk-ledger-item.v1"}},"required":["object_kind","prefix","projection_id","golden_test_id"],"type":"object"},{"additionalProperties":false,"properties":{"golden_test_id":{"const":"F-C15-protocol.positive.baseline"},"object_kind":{"const":"domain_contract"},"prefix":{"const":"dom5_"},"projection_id":{"const":"stable.domain-contract.v1"}},"required":["object_kind","prefix","projection_id","golden_test_id"],"type":"object"},{"additionalProperties":false,"properties":{"golden_test_id":{"const":"F-C15-protocol.positive.baseline"},"object_kind":{"const":"domain_partition"},"prefix":{"const":"dpt5_"},"projection_id":{"const":"stable.domain-partition.v1"}},"required":["object_kind","prefix","projection_id","golden_test_id"],"type":"object"},{"additionalProperties":false,"properties":{"golden_test_id":{"const":"F-C15-protocol.positive.baseline"},"object_kind":{"const":"domain_selection"},"prefix":{"const":"dsl5_"},"projection_id":{"const":"stable.domain-selection.v1"}},"required":["object_kind","prefix","projection_id","golden_test_id"],"type":"object"},{"additionalProperties":false,"properties":{"golden_test_id":{"const":"F-C15-protocol.positive.baseline"},"object_kind":{"const":"entity"},"prefix":{"const":"ent5_"},"projection_id":{"const":"stable.entity.v1"}},"required":["object_kind","prefix","projection_id","golden_test_id"],"type":"object"},{"additionalProperties":false,"properties":{"golden_test_id":{"const":"F-C15-protocol.positive.baseline"},"object_kind":{"const":"entity_conflict_group"},"prefix":{"const":"ecg5_"},"projection_id":{"const":"stable.entity-conflict-group.v1"}},"required":["object_kind","prefix","projection_id","golden_test_id"],"type":"object"},{"additionalProperties":false,"properties":{"golden_test_id":{"const":"F-C15-protocol.positive.baseline"},"object_kind":{"const":"entity_mention_candidate"},"prefix":{"const":"emc5_"},"projection_id":{"const":"stable.entity-mention-candidate.v1"}},"required":["object_kind","prefix","projection_id","golden_test_id"],"type":"object"},{"additionalProperties":false,"properties":{"golden_test_id":{"const":"F-C15-protocol.positive.baseline"},"object_kind":{"const":"field_correspondence"},"prefix":{"const":"fcr5_"},"projection_id":{"const":"stable.field-correspondence.v1"}},"required":["object_kind","prefix","projection_id","golden_test_id"],"type":"object"},{"additionalProperties":false,"properties":{"golden_test_id":{"const":"F-C15-protocol.positive.baseline"},"object_kind":{"const":"oracle_semantic_contract"},"prefix":{"const":"osc5_"},"projection_id":{"const":"stable.oracle-semantic-contract.v1"}},"required":["object_kind","prefix","projection_id","golden_test_id"],"type":"object"},{"additionalProperties":false,"properties":{"golden_test_id":{"const":"F-C15-protocol.positive.baseline"},"object_kind":{"const":"outcome_candidate"},"prefix":{"const":"out5_"},"projection_id":{"const":"stable.outcome-candidate.v1"}},"required":["object_kind","prefix","projection_id","golden_test_id"],"type":"object"},{"additionalProperties":false,"properties":{"golden_test_id":{"const":"F-C15-protocol.positive.baseline"},"object_kind":{"const":"outcome_dedup_group"},"prefix":{"const":"odg5_"},"projection_id":{"const":"stable.outcome-dedup-group.v1"}},"required":["object_kind","prefix","projection_id","golden_test_id"],"type":"object"},{"additionalProperties":false,"properties":{"golden_test_id":{"const":"F-C15-protocol.positive.baseline"},"object_kind":{"const":"permission_auxiliary_contract"},"prefix":{"const":"pac5_"},"projection_id":{"const":"stable.permission-auxiliary-contract.v1"}},"required":["object_kind","prefix","projection_id","golden_test_id"],"type":"object"},{"additionalProperties":false,"properties":{"golden_test_id":{"const":"F-C15-protocol.positive.baseline"},"object_kind":{"const":"permission_matrix_seed"},"prefix":{"const":"pms5_"},"projection_id":{"const":"stable.permission-matrix-seed.v1"}},"required":["object_kind","prefix","projection_id","golden_test_id"],"type":"object"},{"additionalProperties":false,"properties":{"golden_test_id":{"const":"F-C15-protocol.positive.baseline"},"object_kind":{"const":"permission_required_cell"},"prefix":{"const":"prc5_"},"projection_id":{"const":"stable.permission-required-cell.v1"}},"required":["object_kind","prefix","projection_id","golden_test_id"],"type":"object"},{"additionalProperties":false,"properties":{"golden_test_id":{"const":"F-C15-protocol.positive.baseline"},"object_kind":{"const":"permission_scope_candidate"},"prefix":{"const":"psc5_"},"projection_id":{"const":"stable.permission-scope-candidate.v1"}},"required":["object_kind","prefix","projection_id","golden_test_id"],"type":"object"},{"additionalProperties":false,"properties":{"golden_test_id":{"const":"F-C15-protocol.positive.baseline"},"object_kind":{"const":"permission_scope_group"},"prefix":{"const":"psg5_"},"projection_id":{"const":"stable.permission-scope-group.v1"}},"required":["object_kind","prefix","projection_id","golden_test_id"],"type":"object"},{"additionalProperties":false,"properties":{"golden_test_id":{"const":"F-C15-protocol.positive.baseline"},"object_kind":{"const":"population_contract"},"prefix":{"const":"pop5_"},"projection_id":{"const":"stable.population-contract.v1"}},"required":["object_kind","prefix","projection_id","golden_test_id"],"type":"object"},{"additionalProperties":false,"properties":{"golden_test_id":{"const":"F-C15-protocol.positive.baseline"},"object_kind":{"const":"population_proof"},"prefix":{"const":"ppf5_"},"projection_id":{"const":"stable.population-proof.v1"}},"required":["object_kind","prefix","projection_id","golden_test_id"],"type":"object"},{"additionalProperties":false,"properties":{"golden_test_id":{"const":"F-C15-protocol.positive.baseline"},"object_kind":{"const":"predicate_contract"},"prefix":{"const":"pdc5_"},"projection_id":{"const":"stable.predicate-contract.v1"}},"required":["object_kind","prefix","projection_id","golden_test_id"],"type":"object"},{"additionalProperties":false,"properties":{"golden_test_id":{"const":"F-C15-protocol.positive.baseline"},"object_kind":{"const":"question_part"},"prefix":{"const":"qpt5_"},"projection_id":{"const":"stable.question-part.v1"}},"required":["object_kind","prefix","projection_id","golden_test_id"],"type":"object"},{"additionalProperties":false,"properties":{"golden_test_id":{"const":"F-C15-protocol.positive.baseline"},"object_kind":{"const":"risk_review"},"prefix":{"const":"rrv5_"},"projection_id":{"const":"stable.risk-review.v1"}},"required":["object_kind","prefix","projection_id","golden_test_id"],"type":"object"},{"additionalProperties":false,"properties":{"golden_test_id":{"const":"F-C15-protocol.positive.baseline"},"object_kind":{"const":"source_request"},"prefix":{"const":"srq5_"},"projection_id":{"const":"stable.source-request.v1"}},"required":["object_kind","prefix","projection_id","golden_test_id"],"type":"object"}],"type":"array"},"schema_version":{"const":"5.0.0"}},"required":["schema_version","registry_format_version","canonical_profile","rows","registry_digest"],"type":"object"}
