{"canonical_profile":"v5.canonical-json.v1","registry_digest":"sha256:9026224f3ea47b4f57be676de47b3d8d6d7a568381dc615bb53a9a53568eba81","registry_format_version":1,"rows":[{"golden_test_id":"F-C15-protocol.positive.baseline","object_kind":"ambiguity_candidate","prefix":"amb5_","projection_id":"stable.ambiguity-candidate.v1"},{"golden_test_id":"F-C15-protocol.positive.baseline","object_kind":"behavior_equivalence_contract","prefix":"beq5_","projection_id":"stable.behavior-equivalence-contract.v1"},{"golden_test_id":"F-C15-protocol.positive.baseline","object_kind":"behavior_required_contract","prefix":"brq5_","projection_id":"stable.behavior-required-contract.v1"},{"golden_test_id":"F-C15-protocol.positive.baseline","object_kind":"behavior_semantic_gap","prefix":"bsg5_","projection_id":"stable.behavior-semantic-gap.v1"},{"golden_test_id":"F-C15-protocol.positive.baseline","object_kind":"clarification_decision","prefix":"dec5_","projection_id":"stable.clarification-decision.v1"},{"golden_test_id":"F-C15-protocol.positive.baseline","object_kind":"clarification_presentation","prefix":"qpr5_","projection_id":"stable.clarification-presentation.v1"},{"golden_test_id":"F-C15-protocol.positive.baseline","object_kind":"derived_risk_ledger_item","prefix":"rsk5_","projection_id":"stable.derived-risk-ledger-item.v1"},{"golden_test_id":"F-C15-protocol.positive.baseline","object_kind":"domain_contract","prefix":"dom5_","projection_id":"stable.domain-contract.v1"},{"golden_test_id":"F-C15-protocol.positive.baseline","object_kind":"domain_partition","prefix":"dpt5_","projection_id":"stable.domain-partition.v1"},{"golden_test_id":"F-C15-protocol.positive.baseline","object_kind":"domain_selection","prefix":"dsl5_","projection_id":"stable.domain-selection.v1"},{"golden_test_id":"F-C15-protocol.positive.baseline","object_kind":"entity","prefix":"ent5_","projection_id":"stable.entity.v1"},{"golden_test_id":"F-C15-protocol.positive.baseline","object_kind":"entity_conflict_group","prefix":"ecg5_","projection_id":"stable.entity-conflict-group.v1"},{"golden_test_id":"F-C15-protocol.positive.baseline","object_kind":"entity_mention_candidate","prefix":"emc5_","projection_id":"stable.entity-mention-candidate.v1"},{"golden_test_id":"F-C15-protocol.positive.baseline","object_kind":"field_correspondence","prefix":"fcr5_","projection_id":"stable.field-correspondence.v1"},{"golden_test_id":"F-C15-protocol.positive.baseline","object_kind":"oracle_semantic_contract","prefix":"osc5_","projection_id":"stable.oracle-semantic-contract.v1"},{"golden_test_id":"F-C15-protocol.positive.baseline","object_kind":"outcome_candidate","prefix":"out5_","projection_id":"stable.outcome-candidate.v1"},{"golden_test_id":"F-C15-protocol.positive.baseline","object_kind":"outcome_dedup_group","prefix":"odg5_","projection_id":"stable.outcome-dedup-group.v1"},{"golden_test_id":"F-C15-protocol.positive.baseline","object_kind":"permission_auxiliary_contract","prefix":"pac5_","projection_id":"stable.permission-auxiliary-contract.v1"},{"golden_test_id":"F-C15-protocol.positive.baseline","object_kind":"permission_matrix_seed","prefix":"pms5_","projection_id":"stable.permission-matrix-seed.v1"},{"golden_test_id":"F-C15-protocol.positive.baseline","object_kind":"permission_required_cell","prefix":"prc5_","projection_id":"stable.permission-required-cell.v1"},{"golden_test_id":"F-C15-protocol.positive.baseline","object_kind":"permission_scope_candidate","prefix":"psc5_","projection_id":"stable.permission-scope-candidate.v1"},{"golden_test_id":"F-C15-protocol.positive.baseline","object_kind":"permission_scope_group","prefix":"psg5_","projection_id":"stable.permission-scope-group.v1"},{"golden_test_id":"F-C15-protocol.positive.baseline","object_kind":"population_contract","prefix":"pop5_","projection_id":"stable.population-contract.v1"},{"golden_test_id":"F-C15-protocol.positive.baseline","object_kind":"population_proof","prefix":"ppf5_","projection_id":"stable.population-proof.v1"},{"golden_test_id":"F-C15-protocol.positive.baseline","object_kind":"predicate_contract","prefix":"pdc5_","projection_id":"stable.predicate-contract.v1"},{"golden_test_id":"F-C15-protocol.positive.baseline","object_kind":"question_part","prefix":"qpt5_","projection_id":"stable.question-part.v1"},{"golden_test_id":"F-C15-protocol.positive.baseline","object_kind":"risk_review","prefix":"rrv5_","projection_id":"stable.risk-review.v1"},{"golden_test_id":"F-C15-protocol.positive.baseline","object_kind":"source_request","prefix":"srq5_","projection_id":"stable.source-request.v1"}],"schema_version":"5.0.0"}
